{
  "$schema": "https://schemas.neurodock.org/neurotype-addenda/v1/neurotype-addenda.schema.json",
  "artifact_version": "1.0.0",
  "description": "Language-neutral, enum-keyed prompt-shaping content for per-neurotype response tailoring. Single source of truth shared by the NeuroDock browser extension and (in a later PR) the mcp-translation server. This artifact is CONTENT, not schema shape (ADR 0011): it carries no field constraints, only the prose blocks that get appended to a model prompt. The only interpolation tokens are {max_chunk_size} and {notes}.",
  "tokens": ["{max_chunk_size}", "{notes}"],
  "fusion": {
    "description": "AuDHD substitution rule. When the input set lists `audhd` directly, OR lists both `adhd` and `asd`, the fused `audhd` block is substituted: `audhd` is added and `adhd` + `asd` are removed. De-duplication is implied by set semantics.",
    "result": "audhd",
    "any_of": ["audhd"],
    "all_of": ["adhd", "asd"],
    "remove": ["adhd", "asd"]
  },
  "priority": [
    "tourette",
    "dyspraxia",
    "dyslexia",
    "ocd",
    "asd",
    "adhd",
    "audhd",
    "other"
  ],
  "framing": {
    "wrapper_prefix": "\n\n",
    "wrapper_suffix": "\n",
    "section_separator": "\n",
    "block_line_separator": "\n",
    "header": [
      "---",
      "## Reader-specific overrides (apply LAST, after the schema)",
      "",
      "The reader has these preferences. Honor them inside the schema-shaped JSON you're about to write. If a preference conflicts with the schema, the schema wins — but apply every preference that's compatible.",
      ""
    ],
    "footer": ["---"],
    "conflict_footer_min_neurotypes": 3,
    "conflict_footer": "When these preferences conflict (e.g. 'literal' vs 'soft'), prefer the more conservative reading: shorter, more concrete, less pressure."
  },
  "output_format": {
    "prefix": "Output shape: ",
    "separator": " — ",
    "descriptions": {
      "answer_first": "Lead every prose field with the headline conclusion. Reasoning afterwards if at all.",
      "conventional": "Brief context first, then the verdict.",
      "bullet_first": "Lead with a short bullet list before any prose."
    },
    "default": "answer_first"
  },
  "voice_input": {
    "block": [
      "Reader preferences (voice input):",
      "- The reader dictates and cannot cheaply hand-edit fiddly punctuation.",
      "- Keep any example, draft, or snippet as a single, copy-pasteable block — do not scatter editable fragments across the response."
    ]
  },
  "tourette": {
    "block": [
      "Reader preferences (Tourette):",
      "- Be concise. Lead with the answer first; keep prose to the fewest sentences that still carry the meaning.",
      "- Cut throat-clearing, recap, and padding. Shorter responses hold the reader's attention for less time.",
      "- Plain, low-pressure phrasing. Avoid manufactured urgency the source did not have.",
      "- Keep a neutral register. Do not add reassurance, soothing language, or motivational pep — it is not wanted here.",
      "- Do not comment on, notice, or reference the reader's behaviour, composure, or movement anywhere in any field."
    ]
  },
  "other": {
    "block": [
      "Reader preferences (self-described):",
      "- Treat the notes below as a literal instruction set from the reader. Honour any 'please do' / 'please don't' requests.",
      "",
      "Reader's own notes:",
      "{notes}"
    ]
  },
  "generic": {
    "adhd": [
      "Reader preferences (ADHD):",
      "- Lead with the verdict in the first phrase of any free-text field. No throat-clearing.",
      "- Keep prose fields to 1-2 short sentences. Cut qualifiers ('perhaps', 'it seems that', 'arguably').",
      "- Cap any list you return at {max_chunk_size} items even if more would fit the schema. Rank by importance and stop.",
      "- No nested clauses. One idea per sentence.",
      "- If you would say 'however' or 'that said', just start a new sentence.",
      "- Concrete verbs over abstract nouns. 'Send the spec' not 'completion of the spec distribution'."
    ],
    "asd": [
      "Reader preferences (autism):",
      "- State subtext literally. Do not soften with 'perhaps' or 'they might' if the evidence in the text is concrete enough to commit. Use 'the sender wants X' when the text supports it.",
      "- No idioms. Banned phrases include: 'touch base', 'circle back', 'loop in', 'ping you', 'moving forward', 'low-hanging fruit', 'ducks in a row', 'reach out', 'hop on a call', 'in the loop', 'out of pocket'.",
      "- If the input message contains an idiom, decode it literally in your prose ('ping you' -> 'send you a message').",
      "- If a sentence depends on tone of voice or facial expression that text cannot carry, flag that explicitly ('text alone is ambiguous — could be sincere or sarcastic').",
      "- Quote the source verbatim in parentheses when you paraphrase a decision or ask.",
      "- No metaphor. No analogies. No 'kind of' / 'sort of' hedges."
    ],
    "audhd": [
      "Reader preferences (AuDHD):",
      "- Lead with the verdict in the first phrase. Literal first sentence, no throat-clearing.",
      "- One idea per sentence; cap list fields at {max_chunk_size} items.",
      "- No idioms. Banned phrases include: 'touch base', 'circle back', 'loop in', 'ping', 'moving forward', 'low-hanging fruit', 'reach out', 'hop on a call'.",
      "- State subtext as commitments when the text supports it ('the sender wants X'), not as guesses ('they might want X') — but when the text is genuinely ambiguous, say so explicitly rather than picking one reading.",
      "- Concrete verbs over abstract nouns; quote the source verbatim in parentheses when paraphrasing a decision.",
      "- If a sentence depends on tone of voice the text cannot carry, flag that explicitly."
    ],
    "ocd": [
      "Reader preferences (OCD):",
      "- Low-pressure phrasing in any 'what to do' field. Avoid: 'urgent', 'must', 'immediately', 'right away', 'ASAP', 'critical', 'before it's too late', 'don't forget', 'make sure'.",
      "- Prefer: 'when you have a minute', 'no rush — when ready', 'consider', 'you may want to'.",
      "- Do not invent ambiguity or risk that is not in the source. If the message has no actionable issue, say so plainly ('nothing here needs an answer today').",
      "- When ranking items, prefer the lowest-pressure framing first.",
      "- Do not amplify time pressure. If the sender said 'soon', do not paraphrase as 'urgently'.",
      "- Never use the word 'wrong' about the user's draft. Use 'reads as' or 'may land as'."
    ],
    "dyslexia": [
      "Reader preferences (dyslexia):",
      "- Short sentences. Maximum 15 words per sentence. Break compound sentences into two.",
      "- Plain words. Replace 'paraphrased' with 'said plainly', 'ambiguous' with 'unclear', 'verbatim' with 'word-for-word', 'register' with 'tone', 'subtext' with 'what they really mean'.",
      "- One idea per sentence. No semicolons. No em-dashes inside sentences.",
      "- Cap any list at {max_chunk_size} items.",
      "- Free-text prose fields: 1 sentence where the schema permits 2-3.",
      "- Common words over rare ones. 'Use' not 'utilise'. 'Help' not 'facilitate'. 'About' not 'regarding'."
    ],
    "dyspraxia": [
      "Reader preferences (dyspraxia):",
      "- Minimise sequencing burden. Give absolute time markers ('Wednesday 28 May', 'by end of this week') rather than relative ones ('next sprint', 'soon').",
      "- For meeting briefs: if an ask references another ask or decision, name it explicitly rather than saying 'the above' or 'as mentioned earlier'.",
      "- For rewrites: prefer one continuous instruction over a numbered sequence when the action is single-step.",
      "- Cap any list at {max_chunk_size} items.",
      "- Group related items together; do not interleave asks from different topics."
    ]
  },
  "tools": {
    "describe_image": {
      "adhd": [
        "Reader preferences (ADHD) — describe_image:",
        "- INVARIANT: Always populate `content_translation` with one entry per logical item in the image (numbered points, bullets, framework slots, chart series, document sections). Use null ONLY if the image is a decorative avatar/logo/icon with no readable instructional content.",
        "- `content_translation`: cap entries at {max_chunk_size}. Each facet text is verb-led and 8 words or fewer ('Wait 5 seconds.', not 'It might be advisable to wait roughly five seconds'). Prefer `action` + `goal` facets — those are what the ADHD reader scans for.",
        "- 'description': 1 sentence (metadata field). Lead with the inferred purpose in 4-7 words, then what's visually shown.",
        "- 'key_elements': cap at {max_chunk_size}. Most prominent first. Stop ranking when you'd be reaching.",
        "- 'inferred_purpose': a noun phrase, not a sentence. 'Promotional slide' not 'This is a promotional slide that…'.",
        "- No qualifiers ('perhaps', 'appears to', 'seems'). Commit, or flag the uncertainty in 'accessibility_notes'.",
        "- 'accessibility_notes': 1 sentence max. Skip if there is nothing assistive-tech-relevant to add."
      ],
      "asd": [
        "Reader preferences (autism) — describe_image:",
        "- INVARIANT: Always populate `content_translation` with one entry per logical item in the image (numbered points, bullets, framework slots, chart series, document sections). Use null ONLY if the image is a decorative avatar/logo/icon with no readable instructional content.",
        "- `content_translation`: each facet text is a literal commitment, no idioms. Quote the source label verbatim in the 'label' field (e.g. label = '1. Emotional Control (The \"Pause\" Strategy)' exactly as the image renders it). Decode any source idiom literally inside facets ('touch base' → 'send a follow-up message').",